{
  "schema_version": "clue.intelligence.collection-snapshot.v2",
  "snapshot_id": "snapshot-example",
  "created_at": "2026-01-01T00:00:00Z",
  "clues": [
    {
      "clue_id": "clue-001",
      "source_url": "https://source.example/one",
      "observed_at": "2026-01-01T00:00:00Z",
      "content_hash": "sha256:source-one",
      "observations": [
        {
          "observation_id": "observation-001",
          "quote": "Synthetic source statement.",
          "locator": "paragraph=1"
        }
      ]
    }
  ]
}
